{
  "catalogueVersion": "1.2",
  "resultStates": {
    "reasonSeparator": ": ",
    "reasonFormat": "<STATE>: <detail>",
    "classifyOn": "reasonPrefix",
    "classifyOnNote": "Split the reason on the first ':' and match the prefix against states[].name. Never infer state from the pytest verdict: WARN and INFORMATIONAL are reported as skips but both mean the check ran.",
    "states": [
      {
        "name": "PASS",
        "definition": "Assertion ran and succeeded",
        "reasonPrefix": "PASS",
        "countsTowardPassRate": true,
        "executed": true
      },
      {
        "name": "FAIL",
        "definition": "Assertion ran and failed",
        "reasonPrefix": "FAIL",
        "countsTowardPassRate": true,
        "executed": true
      },
      {
        "name": "WARN",
        "definition": "Ran; an advisory threshold was exceeded; the run is not failed",
        "reasonPrefix": "WARN",
        "countsTowardPassRate": false,
        "executed": true
      },
      {
        "name": "SKIPPED_NO_TOKEN",
        "definition": "Auth bootstrap failed, so the API was never executed",
        "reasonPrefix": "SKIPPED_NO_TOKEN",
        "countsTowardPassRate": false,
        "executed": false
      },
      {
        "name": "NOT_APPLICABLE",
        "definition": "The check cannot apply because required metadata is absent",
        "reasonPrefix": "NOT_APPLICABLE",
        "countsTowardPassRate": false,
        "executed": false
      },
      {
        "name": "NOT_ASSERTED",
        "definition": "The request executed but no assertion exists for it",
        "reasonPrefix": "NOT_ASSERTED",
        "countsTowardPassRate": false,
        "executed": false
      },
      {
        "name": "INFORMATIONAL",
        "definition": "Observes and records; asserts nothing about the response",
        "reasonPrefix": "INFORMATIONAL",
        "countsTowardPassRate": false,
        "executed": true
      }
    ],
    "passRateDenominatorStates": [
      "FAIL",
      "PASS"
    ],
    "passRateExcludedStates": [
      "INFORMATIONAL",
      "NOT_APPLICABLE",
      "NOT_ASSERTED",
      "SKIPPED_NO_TOKEN",
      "WARN"
    ],
    "passRateFormula": "PASS / (PASS + FAIL)",
    "passRateNote": "Undefined when PASS + FAIL is zero \u2014 report 'not applicable', never 100%. A batch of entirely NOT_ASSERTED APIs has no pass rate.",
    "executedStates": [
      "FAIL",
      "INFORMATIONAL",
      "PASS",
      "WARN"
    ]
  },
  "apis": [
    {
      "ref": "delete|/api/attendance/holiday-templates/delete/%7bholidaytemplateid%7d|holiday template apis copy|delete",
      "displayId": null,
      "name": "Delete",
      "module": "Holiday Template APIs Copy",
      "subModule": "Delete",
      "method": "DELETE",
      "path": "/api/attendance/holiday-templates/delete/%7BholidayTemplateId%7D",
      "owner": null,
      "sourceType": "newman",
      "sourceCollection": "collections/Holiday_Template_API.json",
      "assertionState": "not-asserted"
    },
    {
      "ref": "delete|/api/attendance/status-thresholds/delete/1|attendance status threshold api|delete threshold",
      "displayId": null,
      "name": "Delete Threshold",
      "module": "Attendance Status Threshold API",
      "subModule": "Delete Threshold",
      "method": "DELETE",
      "path": "/api/attendance/status-thresholds/delete/1",
      "owner": null,
      "sourceType": "newman",
      "sourceCollection": "collections/Attendance_Threshold_API.json",
      "assertionState": "not-asserted"
    },
    {
      "ref": "delete|/api/attendancepolicy/2|attendance policy master|delete policy by id",
      "displayId": null,
      "name": "Delete Policy By Id",
      "module": "Attendance Policy Master",
      "subModule": "Delete Policy By Id",
      "method": "DELETE",
      "path": "/api/attendancepolicy/2",
      "owner": null,
      "sourceType": "newman",
      "sourceCollection": "collections/Attendance_Management_API.json",
      "assertionState": "not-asserted"
    },
    {
      "ref": "delete|/api/v1/attendance/shift/master/6|attendance shift master|delete shift",
      "displayId": null,
      "name": "Delete Shift",
      "module": "Attendance Shift Master",
      "subModule": "Delete Shift",
      "method": "DELETE",
      "path": "/api/v1/attendance/shift/master/6",
      "owner": null,
      "sourceType": "newman",
      "sourceCollection": "collections/Attendance_Management_API.json",
      "assertionState": "not-asserted"
    },
    {
      "ref": "get|/api/attendance/holiday-templates/getall|holiday template apis copy|get all",
      "displayId": null,
      "name": "Get All",
      "module": "Holiday Template APIs Copy",
      "subModule": "Get All",
      "method": "GET",
      "path": "/api/attendance/holiday-templates/getAll",
      "owner": null,
      "sourceType": "newman",
      "sourceCollection": "collections/Holiday_Template_API.json",
      "assertionState": "not-asserted"
    },
    {
      "ref": "get|/api/attendance/holiday-templates/getbyid/19|holiday template apis copy|get by id",
      "displayId": null,
      "name": "Get By Id",
      "module": "Holiday Template APIs Copy",
      "subModule": "Get By Id",
      "method": "GET",
      "path": "/api/attendance/holiday-templates/getById/19",
      "owner": null,
      "sourceType": "newman",
      "sourceCollection": "collections/Holiday_Template_API.json",
      "assertionState": "not-asserted"
    },
    {
      "ref": "get|/api/attendance/late-early-policies/getall|latearly-policy|getall",
      "displayId": null,
      "name": "getAll",
      "module": "Latearly-Policy",
      "subModule": "getAll",
      "method": "GET",
      "path": "/api/attendance/late-early-policies/getAll",
      "owner": null,
      "sourceType": "newman",
      "sourceCollection": "collections/Late_Early_Policy_API.json",
      "assertionState": "not-asserted"
    },
    {
      "ref": "get|/api/attendance/late-early-policies/getbyid/5|latearly-policy|getbyid/1",
      "displayId": null,
      "name": "getById/1",
      "module": "Latearly-Policy",
      "subModule": "getById/1",
      "method": "GET",
      "path": "/api/attendance/late-early-policies/getById/5",
      "owner": null,
      "sourceType": "newman",
      "sourceCollection": "collections/Late_Early_Policy_API.json",
      "assertionState": "not-asserted"
    },
    {
      "ref": "get|/api/attendance/status-threshold/getall|attendance status threshold api|get all",
      "displayId": null,
      "name": "Get All",
      "module": "Attendance Status Threshold API",
      "subModule": "Get All",
      "method": "GET",
      "path": "/api/attendance/status-threshold/getAll",
      "owner": null,
      "sourceType": "newman",
      "sourceCollection": "collections/Attendance_Threshold_API.json",
      "assertionState": "not-asserted"
    },
    {
      "ref": "get|/api/attendance/status-threshold/getbyid/8|attendance status threshold api|get by id",
      "displayId": null,
      "name": "Get By Id",
      "module": "Attendance Status Threshold API",
      "subModule": "Get By Id",
      "method": "GET",
      "path": "/api/attendance/status-threshold/getById/8",
      "owner": null,
      "sourceType": "newman",
      "sourceCollection": "collections/Attendance_Threshold_API.json",
      "assertionState": "not-asserted"
    },
    {
      "ref": "get|/api/attendance/week-offs/getall|attenedance-july2026|weekoffgetall",
      "displayId": null,
      "name": "WeekOffGetAll",
      "module": "Attenedance-july2026",
      "subModule": "WeekOffGetAll",
      "method": "GET",
      "path": "/api/attendance/week-offs/getAll",
      "owner": null,
      "sourceType": "newman",
      "sourceCollection": "collections/Weekoff_Policy_API.json",
      "assertionState": "not-asserted"
    },
    {
      "ref": "get|/api/attendance/week-offs/getbyid/1|attenedance-july2026|weekoffgetbyid",
      "displayId": null,
      "name": "WeekOffGetById",
      "module": "Attenedance-july2026",
      "subModule": "WeekOffGetById",
      "method": "GET",
      "path": "/api/attendance/week-offs/getById/1",
      "owner": null,
      "sourceType": "newman",
      "sourceCollection": "collections/Weekoff_Policy_API.json",
      "assertionState": "not-asserted"
    },
    {
      "ref": "get|/api/attendancepolicy/1|attendance policy master|get policy by id",
      "displayId": null,
      "name": "Get Policy By Id",
      "module": "Attendance Policy Master",
      "subModule": "Get Policy By Id",
      "method": "GET",
      "path": "/api/attendancepolicy/1",
      "owner": null,
      "sourceType": "newman",
      "sourceCollection": "collections/Attendance_Management_API.json",
      "assertionState": "not-asserted"
    },
    {
      "ref": "get|/api/attendancepolicy|attendance policy master|get all policies",
      "displayId": null,
      "name": "Get All Policies",
      "module": "Attendance Policy Master",
      "subModule": "Get All Policies",
      "method": "GET",
      "path": "/api/attendancepolicy",
      "owner": null,
      "sourceType": "newman",
      "sourceCollection": "collections/Attendance_Management_API.json",
      "assertionState": "not-asserted"
    },
    {
      "ref": "get|/api/v1/attendance/shift/master/7|attendance shift master|get by id",
      "displayId": null,
      "name": "Get By Id",
      "module": "Attendance Shift Master",
      "subModule": "Get By Id",
      "method": "GET",
      "path": "/api/v1/attendance/shift/master/7",
      "owner": null,
      "sourceType": "newman",
      "sourceCollection": "collections/Attendance_Management_API.json",
      "assertionState": "not-asserted"
    },
    {
      "ref": "get|/api/v1/attendance/shift/master|attendance shift master|get all shifts",
      "displayId": null,
      "name": "Get All Shifts",
      "module": "Attendance Shift Master",
      "subModule": "Get All Shifts",
      "method": "GET",
      "path": "/api/v1/attendance/shift/master",